{
  "schema_version": "1.0",
  "subject": {
    "kind": "gnostoa-protected-main-consumer-record",
    "value": "tasks/issue-11-r2a-current-advisory-consumer.json:v1"
  },
  "expected_consumer": {
    "role": "current_advisory_outer_consumer",
    "acquisition": "oci",
    "source_revision": "f29499286bac9859364d45da0f6c59396518b749",
    "source_tree": "ff38abe5718ebc550054ea6af18a73d0aef8e514",
    "public_surface_digest": "sha256:c8536ac1f726f1d04f331c95f85a9df128b7cdb818213785cbd6b0b0940f9c57",
    "runtime_image": "ghcr.io/ktogias/gnostoa@sha256:d4cc72b0ed7342f533dd3bcf32ddf9888203f85408154f4066883ba9d33fe867",
    "runtime_revision": "f29499286bac9859364d45da0f6c59396518b749",
    "supported_input_schema_versions": [
      "1.0"
    ],
    "status": "accepted"
  },
  "acquired_consumer": {
    "role": "current_advisory_outer_consumer",
    "acquisition": "oci",
    "source_revision": "f29499286bac9859364d45da0f6c59396518b749",
    "source_tree": "ff38abe5718ebc550054ea6af18a73d0aef8e514",
    "public_surface_digest": "sha256:c8536ac1f726f1d04f331c95f85a9df128b7cdb818213785cbd6b0b0940f9c57",
    "runtime_image": "ghcr.io/ktogias/gnostoa@sha256:d4cc72b0ed7342f533dd3bcf32ddf9888203f85408154f4066883ba9d33fe867",
    "runtime_revision": "f29499286bac9859364d45da0f6c59396518b749",
    "supported_input_schema_versions": [
      "1.0"
    ],
    "status": "accepted"
  },
  "materialization": {
    "protected_main_revision": "f8aac5159c36a0ff8cb9a22dcc933285c6b52b81",
    "workflow_run": "35058782405",
    "attestation_id": "47823269",
    "rekor_log_index": "2855771710",
    "receipt": "https://github.com/ktogias/gnostoa/issues/11#issuecomment-5692487663"
  }
}
